{
    "data_config": {
        "image_directory": "/path/to/OAI/Data",
        "label_directory": "/path/to/OAI/Data_labels",
        "split_file": "kneeseg/data/oai_split.json"
    },
    "inference_config": {
        "inference_proximity_mm": 20.0
    },
    "model_config": {
        "target_bones": [
            "femur",
            "tibia",
            "patella"
        ],
        "model_directory": "./experiments/models_unified"
    },
    "output_config": {
        "prediction_directory": "./experiments/predictions_unified_oai"
    }
}
