{
    "data_config": {
        "image_directory": "/path/to/OAI/Data",
        "label_directory": "/path/to/OAI/Data_labels",
        "split_file": "kneeseg/data/oai_split.json"
    },
    "training_config": {
        "augmentation": true,
        "bone_parameters": {
            "n_estimators": 100,
            "max_depth": 25,
            "n_jobs": -1
        },
        "cartilage_parameters": {
            "n_estimators": 100,
            "max_depth": 20,
            "subsample_voxels_per_case": 20000,
            "training_proximity_mm": 15.0
        }
    },
    "model_config": {
        "target_bones": [
            "femur",
            "tibia",
            "patella"
        ],
        "model_directory": "./experiments/models_oai"
    },
    "output_config": {
    }
}
