{
    "data_config": {
        "image_directory": "/path/to/SKI10/TrainingData",
        "label_directory": "/path/to/SKI10/TrainingData_labels",
        "split_file": "kneeseg/data/ski10_full_split.json"
    },
    "inference_config": {
        "inference_proximity_mm": 10.0,
        "use_random_walker": true,
        "random_walker_beta": 130.0
    },
    "model_config": {
        "model_directory": "./experiments/models"
    },
    "output_config": {
        "prediction_directory": "./experiments/predictions"
    }
}